{
  "$schema": "http://json-schema.org/draft-04/schema#",
  "type": "object",
  "properties": {
    "id": {
      "type": "string"
    },
    "qualifyStandingType": {
      "type": "integer"
    },
    "superpoleMaxCar": {
      "type": "integer"
    },
    "pitWindowLengthSec": {
      "type": "integer"
    },
    "driverStintTimeSec": {
      "type": "integer"
    },
    "mandatoryPitstopCount": {
      "type": "integer"
    },
    "maxTotalDrivingTime": {
      "type": "integer"
    },
    "maxDriversCount": {
      "type": "integer"
    },
    "isRefuellingAllowedInRace": {
      "type": "boolean"
    },
    "isRefuellingTimeFixed": {
      "type": "boolean"
    },
    "isMandatoryPitstopRefuellingRequired": {
      "type": "boolean"
    },
    "isMandatoryPitstopTyreChangeRequired": {
      "type": "boolean"
    },
    "isMandatoryPitstopSwapDriverRequired": {
      "type": "boolean"
    },
    "tyreSetCount": {
      "type": "integer"
    }
  },
  "required": [
    "id",
    "qualifyStandingType",
    "superpoleMaxCar",
    "pitWindowLengthSec",
    "driverStintTimeSec",
    "mandatoryPitstopCount",
    "maxTotalDrivingTime",
    "maxDriversCount",
    "isRefuellingAllowedInRace",
    "isRefuellingTimeFixed",
    "isMandatoryPitstopRefuellingRequired",
    "isMandatoryPitstopTyreChangeRequired",
    "isMandatoryPitstopSwapDriverRequired",
    "tyreSetCount"
  ]
}