{
  "id": "5d405fca-6df0-45ba-9fa3-c163e294be06",
  "qualifyStandingType": 1,
  "superpoleMaxCar": -1,
  "pitWindowLengthSec": -1,
  "driverStintTimeSec": -1,
  "mandatoryPitstopCount": 0,
  "maxTotalDrivingTime": -1,
  "maxDriversCount": 1,
  "isRefuellingAllowedInRace": true,
  "isRefuellingTimeFixed": false,
  "isMandatoryPitstopRefuellingRequired": false,
  "isMandatoryPitstopTyreChangeRequired": false,
  "isMandatoryPitstopSwapDriverRequired": false,
  "tyreSetCount": 50
}